{"candidate":{"configuration":{"id":"qualification-config-v1","sha256":"aaaaaaaaaaaaaaaaaaaaaaaaaaaaaaaaaaaaaaaaaaaaaaaaaaaaaaaaaaaaaaaa"},"exclusions":["analog-touch","rf-coexistence","power-and-thermal"],"firmware_image_sha256":"8888888888888888888888888888888888888888888888888888888888888888","firmware_revision":"7777777777777777777777777777777777777777","fs_wp_002g_campaign_sha256":"6666666666666666666666666666666666666666666666666666666666666666","hardware":{"id":"nff-v1","sha256":"9999999999999999999999999999999999999999999999999999999999999999"},"model_sha256":"3333333333333333333333333333333333333333333333333333333333333333","prediction_envelope":{"dimensions":["scheduler","transport","stale-event","recovery","concurrency"],"id":"transport-scheduler-envelope-v1","sha256":"9bd585a8e3c0399812b3e786519830c2713c17fdc9108620387f70206a17f8ea"}},"clock_correlation":{"method":"paired-monotonic-markers-v1","method_sha256":"3fa564c22a6de5608ddff582564261413b12bc149dea190764cabe17fc0ee519","uncertainty_ns":25000},"controller_attestation_sha256":"755b2c1a3837b93c17f67f91150a5c17bedaef03e6aa1a9143e512b6bbd0ea1b","corpus_construction":{"completeness_sha256":"e50bda22d0d0abdc445cfdebb1a825be3f4894e7ec86aadc991c99b98745a241","method":"independent-static-envelope-enumeration-v1","mutant_definition_sha256s":["cc348475ed30600515be37cb881098d7996b926b51d41dad8d29bab3af8c45cd","ce9d3faa08c4e9cf1f894c87ea11eddbcb42494ee0bd094580ef6aefebe59f8f","41f171627c6d6db81ffcc16671980ae5626052bf724452d7dedbd771db30597a","26d68d248ee234d1f2f1ddac19bb1d2671533ffb7760c7c1ba6500dbc6827ec2","331d5dfea093fb6dcf51daa54b3b58116ab47408365d9294ccaaf3deea7d93fd","a0886798c53e002a648f4d4faa9514d3926db8e018b212eff8aa3b7c30742c61","c0e61edbd1ad20220cbd93f67a941c0dce4aea5187b6f5c48aaa14b44635a3ad","c855121dbd75cef0aa600d0795bc53403ef9b471a8b7f1748b007739a4dea8ae","0e41dc6d9df566b3ecea98ab5a27b94f6edc5b3546d0321bf457ad06b39839f9","00fea41940dfeb5d7e9051c6136f98c54a8976c49d6f56162f162ebace9dab9c","e608761db4630f9e59aa0b1c6956b81213ecd0913b2ae656d8e7c9f4a6720988","66d78071b6b7732cca0445cb47acd639814b0e217d4a8fef3048c8aa19c6a2fa","569f0efd1280eb093df6b3ebbde66b342ae2a8a8b4d2a9fed73c7fda2132eb89","2e7f278b1287ba38ef933e04c7ce3e81d6b37734653be2d65c102f7e06cbe7da","2d427d7b8637e56177b822123e536edff3f35a5342ff59f70ef6947b0193ac06"],"prediction_envelope_sha256":"9bd585a8e3c0399812b3e786519830c2713c17fdc9108620387f70206a17f8ea","required_classes":["scheduler","transport","stale-event","recovery","concurrency"]},"creation_phase":"pre-held-out","datasets":{"calibration":[{"id":"calibration-a","normalized_trace_sha256":"eeeeeeeeeeeeeeeeeeeeeeeeeeeeeeeeeeeeeeeeeeeeeeeeeeeeeeeeeeeeeeee","raw_trace_sha256":"dddddddddddddddddddddddddddddddddddddddddddddddddddddddddddddddd","scenario":"calibration-link","scenario_sha256":"823bc95e6217163cceb4941927c41eff776954003644e466c760a7633af52576","seed":10,"seed_sha256":"917df3320d778ddbaa5c5c7742bc4046bf803c36ed2b050f30844ed206783469","sha256":"cccccccccccccccccccccccccccccccccccccccccccccccccccccccccccccccc"}],"held_out":[{"id":"held-out-scheduler","normalized_trace_sha256":"0303030303030303030303030303030303030303030303030303030303030303","raw_trace_sha256":"0202020202020202020202020202020202020202020202020202020202020202","scenario":"scheduler","scenario_sha256":"3ccb9c09519fd83854d12f1dda78f2384e4cc72b80e2fd05f45885b8b028f2a4","seed":101,"seed_sha256":"39b8dc3fc8b44765c8e6f1adee04c5b465e555ab791cc42d0d9e810d5b64297c","sha256":"0101010101010101010101010101010101010101010101010101010101010101"},{"id":"held-out-transport","normalized_trace_sha256":"0606060606060606060606060606060606060606060606060606060606060606","raw_trace_sha256":"0505050505050505050505050505050505050505050505050505050505050505","scenario":"transport","scenario_sha256":"a04b6b53b85a6d9a10a3d2c1cf6fab86bfacfd439e6ae9133ef2b0561d0be6d5","seed":202,"seed_sha256":"1a55a7d16b47deb40890edb52c2234c4adddf330dbac2e1f1eedf0a9723a4c70","sha256":"0404040404040404040404040404040404040404040404040404040404040404"},{"id":"held-out-stale-event","normalized_trace_sha256":"0909090909090909090909090909090909090909090909090909090909090909","raw_trace_sha256":"0808080808080808080808080808080808080808080808080808080808080808","scenario":"stale-event","scenario_sha256":"5f1cd94cff4708912e3c36956b66cee00e0ace09ac518939cfb2f78ce09d8adb","seed":303,"seed_sha256":"38c62c0e8256ed8bcb1b23a308d84d8271d6d77121b6e739a993139ee42fa950","sha256":"0707070707070707070707070707070707070707070707070707070707070707"},{"id":"held-out-recovery","normalized_trace_sha256":"1818181818181818181818181818181818181818181818181818181818181818","raw_trace_sha256":"1717171717171717171717171717171717171717171717171717171717171717","scenario":"recovery","scenario_sha256":"77c40a24cc765a417e18890269459c67dac6d065737b9b7cfc92b9c155d2ddf3","seed":404,"seed_sha256":"f8bf41177a5f5e808a7ccb648b51080b031f15ca8018d91a576263d6cc626eb6","sha256":"1616161616161616161616161616161616161616161616161616161616161616"},{"id":"held-out-concurrency","normalized_trace_sha256":"2121212121212121212121212121212121212121212121212121212121212121","raw_trace_sha256":"2020202020202020202020202020202020202020202020202020202020202020","scenario":"concurrency","scenario_sha256":"c9980125e10083dbbb48276a48e7ee4b4858e640ce1dd531845bf392b84538f2","seed":505,"seed_sha256":"6edc21b6621379f6ba6b0c31a75044a6a0dc11746064237204c0c1716227fd33","sha256":"1919191919191919191919191919191919191919191919191919191919191919"}]},"entry":{"result":"passed","terminal_candidate":{"artifact_class":"terminal-executed-validation","candidate_sha256":"99e09beda5b1a513435dacaec80b4ec4919c295e89b154a3f55e561b0dae097d","commit":"1111111111111111111111111111111111111111","evidence_sha256":"2222222222222222222222222222222222222222222222222222222222222222","fs_wp_002g":{"campaign_sha256":"6666666666666666666666666666666666666666666666666666666666666666","commit":"4444444444444444444444444444444444444444","evidence_sha256":"5555555555555555555555555555555555555555555555555555555555555555","issue":164},"issue":171}},"exclusions":["analog-touch","rf-coexistence","power-and-thermal"],"held_out_scenarios":[{"dataset_id":"held-out-scheduler","dataset_sha256":"0101010101010101010101010101010101010101010101010101010101010101","id":"scheduler","normalized_trace_sha256":"0303030303030303030303030303030303030303030303030303030303030303","raw_trace_sha256":"0202020202020202020202020202020202020202020202020202020202020202","scenario_sha256":"3ccb9c09519fd83854d12f1dda78f2384e4cc72b80e2fd05f45885b8b028f2a4","seed":101,"seed_sha256":"39b8dc3fc8b44765c8e6f1adee04c5b465e555ab791cc42d0d9e810d5b64297c"},{"dataset_id":"held-out-transport","dataset_sha256":"0404040404040404040404040404040404040404040404040404040404040404","id":"transport","normalized_trace_sha256":"0606060606060606060606060606060606060606060606060606060606060606","raw_trace_sha256":"0505050505050505050505050505050505050505050505050505050505050505","scenario_sha256":"a04b6b53b85a6d9a10a3d2c1cf6fab86bfacfd439e6ae9133ef2b0561d0be6d5","seed":202,"seed_sha256":"1a55a7d16b47deb40890edb52c2234c4adddf330dbac2e1f1eedf0a9723a4c70"},{"dataset_id":"held-out-stale-event","dataset_sha256":"0707070707070707070707070707070707070707070707070707070707070707","id":"stale-event","normalized_trace_sha256":"0909090909090909090909090909090909090909090909090909090909090909","raw_trace_sha256":"0808080808080808080808080808080808080808080808080808080808080808","scenario_sha256":"5f1cd94cff4708912e3c36956b66cee00e0ace09ac518939cfb2f78ce09d8adb","seed":303,"seed_sha256":"38c62c0e8256ed8bcb1b23a308d84d8271d6d77121b6e739a993139ee42fa950"},{"dataset_id":"held-out-recovery","dataset_sha256":"1616161616161616161616161616161616161616161616161616161616161616","id":"recovery","normalized_trace_sha256":"1818181818181818181818181818181818181818181818181818181818181818","raw_trace_sha256":"1717171717171717171717171717171717171717171717171717171717171717","scenario_sha256":"77c40a24cc765a417e18890269459c67dac6d065737b9b7cfc92b9c155d2ddf3","seed":404,"seed_sha256":"f8bf41177a5f5e808a7ccb648b51080b031f15ca8018d91a576263d6cc626eb6"},{"dataset_id":"held-out-concurrency","dataset_sha256":"1919191919191919191919191919191919191919191919191919191919191919","id":"concurrency","normalized_trace_sha256":"2121212121212121212121212121212121212121212121212121212121212121","raw_trace_sha256":"2020202020202020202020202020202020202020202020202020202020202020","scenario_sha256":"c9980125e10083dbbb48276a48e7ee4b4858e640ce1dd531845bf392b84538f2","seed":505,"seed_sha256":"6edc21b6621379f6ba6b0c31a75044a6a0dc11746064237204c0c1716227fd33"}],"input_allowlist":["candidate","clock_correlation","controller_attestation","creation_phase","datasets","invalidation_rules","kind","schema_version","specification_revision","terminal_candidate","tools"],"input_allowlist_sha256":"a2c9973156f9e053932f06abf048731937d05d10e4f6b5a8e6200800799984e6","invalidation_rules":["model_identity_changed","firmware_revision_or_image_changed","task_topology_priority_or_affinity_changed","transport_lifecycle_or_peer_protocol_changed","timing_source_changed","esp_idf_or_qemu_version_changed","board_profile_or_relevant_hardware_changed","calibrated_environment_changed","corpus_or_held_out_scenarios_changed","metrics_bounds_or_thresholds_changed"],"kind":"vc-wp-002a-corpus-threshold-freeze","manifest_sha256":"b5b4c30218cce0a7752d7a038bf4663400a537b9b496ce7948d41a1ac900a84e","metrics":[{"bound":"exact-match","id":"outcome"},{"bound":"zero-unexplained-inversions","id":"ordering"},{"bound":"absolute-error-us<=250","id":"timeout"},{"bound":"absolute-error<=1","id":"queue-depth"},{"bound":"p95-absolute-error-us<=500","id":"latency"}],"mutation_corpus":[{"class":"scheduler","critical_seeded_fault":true,"definition":{"activation":"single-seeded-fault","expected_observation":"candidate-prediction-versus-mutated-trace","injection_point":"scheduler.ready-queue","operator":"invert-ready-priority"},"definition_sha256":"cc348475ed